Job Title,Company,Address,Link,Description
entry level Java spring boot Developer/Jr. Data Scientist (Remote),SynergisticIT,"Phoenix, AZ
1 week ago",https://www.linkedin.com/jobs/view/entry-level-java-spring-boot-developer-jr-data-scientist-remote-at-synergisticit-4151083145?position=12&pageNum=0&refId=U%2FMlleeZRyObDBg%2FLIpiUg%3D%3D&trackingId=BrSmpoyuPNLKn3j%2B7sjz9A%3D%3D,"Since 2010 SynergisticIT has helped Jobseekers get employed in the tech Job market by providing candidates the requisite skills, experience and technical competence to outperform at interviews and at clients.
The Tech Job market has been affected by massive layoffs and since 2021 there have been more than 600,000.00 tech layoffs.
The Job market is Hyper Competitive. For 1 position 500-1000 candidates or more are applying and laid off job seekers are also competing for entry level Job positions.
Please see the below links to know more about Synergisticit and some useful tips
Synergisticit Pics /Salaries of Successful Candidates
Synergisticit at Oracle Cloudworld 2023
Synergisticit at Gartner Data & Analytics summit
Why do Tech Companies not Hire recent Computer Science Graduates | SynergisticIT
Technical Skills or Experience? | Which one is important to get a Job? | SynergisticIT
We regularly interact with the Top Tech companies to give our candidates a competitive advantage.
We at Synergisticit understand the problem of the mismatch between employer's requirements and Employee skills and that's why since 2010 we have helped 1000's of candidates get jobs at technology clients like
apple, google, Paypal, western union, Client, visa, walmart lab
s etc to name a few.
We are continuously looking for
entry-level software programmers, Java Full stack developers, Python/Java developers, Data analysts/ Data Scientists, Data Engineers, Machine Learning engineers
for full time positions with clients.
Who Should Apply? Recent Computer science/Engineering /Mathematics/Statistics or Science Graduates or People looking to switch careers or who have had gaps in employment and looking to make their careers in the Tech Industry.
We need Data Science/Machine learning/Data Analyst and Java Full stack candidates
Preferred SKILLS For Java /Full Stack/Devops Positions
Bachelors degree or Masters degree in Computer Science, Computer Engineering, Electrical Engineering, Information Systems, IT
Knowledge of Core Java , javascript , C++ or software programming
Spring boot, Microservices, Docker, Jenkins, Github, Kubernates and REST API's experience
For data Science/Data Analyst/AI/Machine learning Positions
Preferred SKILLS
Associate or Bachelors degree or Masters degree in Computer Science, Computer Engineering, Electrical Engineering, Information Systems, IT, Statistics, Mathematics or having good logical aptitude
Knowledge of Statistics, Gen AI, LLM, Sagemaker, Python, Computer Vision, data visualization tools
Candidates lacking technical skills can research our other programs which can assist in landing a Job
If you get emails from our Job Placement team and are not interested please email them or ask them to take you off their distribution list and make you unavailable as they share the same database with the client servicing team who only connect with candidates who are matching client requirements.
No phone calls please.
Shortlisted candidates would be reached out.
No third party or agency candidates or c2c candidates
Show more
Show less"
"Engineer - JavaScript/TypeScript, Java - One Market",American Express,"Phoenix, AZ
Actively Hiring
1 day ago",https://www.linkedin.com/jobs/view/engineer-javascript-typescript-java-one-market-at-american-express-4158026878?position=13&pageNum=0&refId=U%2FMlleeZRyObDBg%2FLIpiUg%3D%3D&trackingId=QWtjfOPZKIK2MymB3GxY7g%3D%3D,"You Lead the Way. We’ve Got Your Back.
With the right backing, people and businesses have the power to progress in incredible ways. When you join Team Amex, you become part of a global and diverse community of colleagues with an unwavering commitment to back our customers, communities and each other. Here, you’ll learn and grow as we help you create a career journey that’s unique and meaningful to you with benefits, programs, and flexibility that support you personally and professionally.
At American Express, you’ll be recognized for your contributions, leadership, and impact—every colleague has the opportunity to share in the company’s success. Together, we’ll win as a team, striving to uphold our company values and powerful backing promise to provide the world’s best customer experience every day. And we’ll do it with the utmost integrity, and in an environment where everyone is seen, heard and feels like they belong.
Join Team Amex and let's lead the way together.
As part of our diverse tech team, you can architect, code and ship software that makes us an essential part of our customers’ digital lives.
Here, you can work alongside talented engineers in an open, supportive, inclusive environment where your voice is valued, and you make your own decisions on what tech to use to solve challenging problems.
American Express offers a range of opportunities to work with the latest technologies and encourages you to back the broader engineering community through open source.
And because we understand the importance of keeping your skills fresh and relevant, we give you dedicated time to invest in your professional development.
Find your place in technology on #TeamAmex.
The U.S. Consumer Services and Enterprise Digital & Data Technology Team brings together foundational strategic technology capabilities in digital experience engineering (Mobile and Web), AI/ML, marketing technology, enterprise communications, travel and lifestyle, and automation, grounded in our data technology model that prioritizes data governance. It employs a ground-breaking focus with development responsibilities for customer-facing capabilities that deepen and expand digital engagement, as well as core technical capabilities that cut across business lines and customer segments.
The One Market team develops the company's internal platform for enterprise-grade web crawling and technical SEO.  This tool empowers teams across the organization to gain insights into website performance while enforcing SEO best practices and change management for search optimization strategies.
How will you make an impact in this role?
Contribute to design, development, testing, troubleshooting, debugging, modifying, deployment, documentation, reliability, and availability of software and systems that meet the needs of customer-facing applications, business applications, and/or internal end user tools and applications.
Entry level ability in software development
Function as member of a software engineering team by contributing to software builds through consistent development practices (tools, common components, and documentation)
Demonstrate increased self-reliance to achieve team goals
Participate in code reviews and automated testing
Debug basic software components and identify code defects for remediation
Enable the development, support, and monitoring of software across test, integration, and production environments
Automate deployments in test or production environments
Automatically scale applications based on demand projections
Adhere to security and regulatory best practices
Minimum Qualifications
Up to 4 years of software development experience in a professional environment and/or comparable experience such as:
Familiar with Agile or other rapid application development methods
Experience with design and coding across one or more platforms and as appropriate
Hands-on experience with application design, software development, and automated testing
Exposure to distributed (multi-tiered) systems, algorithms, and databases
Experience with object-oriented design and coding with variety of languages
Bachelor’s Degree in computer science, computer engineering, or related experience required
Preferred Qualifications
Technical SEO, Google Search Console, Lumar, Conductor, SEMRush
Domain Driven Design, CQRS, Event Sourcing
JavaScript/TypeScript, Java
React, RxJS
NestJS, Node.js
MongoDB, PostgreSQL
Docker, Kubernetes, OpenShift, Linux, Akamai
Git, Jenkins, GitHub Actions
Docusaurus, Storybook
Salary Range: $85,000.00 to $150,000.00 annually + bonus + benefits
The above represents the expected salary range for this job requisition. Ultimately, in determining your pay, we’ll consider your location, experience, and other job-related factors.
We back our colleagues and their loved ones with benefits and programs that support their holistic well-being. That means we prioritize their physical, financial, and mental health through each stage of life. Benefits include:
Competitive base salaries
Bonus incentives
6% Company Match on retirement savings plan
Free financial coaching and financial well-being support
Comprehensive medical, dental, vision, life insurance, and disability benefits
Flexible working model with hybrid, onsite or virtual arrangements depending on role and business need
20+ weeks paid parental leave for all parents, regardless of gender, offered for pregnancy, adoption or surrogacy
Free access to global on-site wellness centers staffed with nurses and doctors (depending on location)
Free and confidential counseling support through our Healthy Minds program
Career development and training opportunities
For a full list of Team Amex benefits, visit our
Colleague Benefits Site
.
American Express is an equal opportunity employer and makes employment decisions without regard to race, color, religion, sex, sexual orientation, gender identity, national origin, veteran status, disability status, age, or any other status protected by law.
We back our colleagues with the support they need to thrive, professionally and personally. That's why we have Amex Flex, our enterprise working model that provides greater flexibility to colleagues while ensuring we preserve the important aspects of our unique in-person culture. Depending on role and business needs, colleagues will either work onsite, in a hybrid model (combination of in-office and virtual days) or fully virtually.
US Job Seekers/Employees -
Click here
to view the “Know Your Rights” poster and the Pay Transparency Policy Statement.
If the links do not work, please copy and paste the following URLs in a new browser window: https://www.dol.gov/agencies/ofccp/posters to access the three posters.
Employment eligibility to work with American Express in the U.S. is required as the company will not pursue visa sponsorship for these positions.
Show more
Show less"
Java Backend Developer,Accord Technologies Inc,"Phoenix, AZ
Actively Hiring
4 weeks ago",https://www.linkedin.com/jobs/view/java-backend-developer-at-accord-technologies-inc-4132363569?position=14&pageNum=0&refId=U%2FMlleeZRyObDBg%2FLIpiUg%3D%3D&trackingId=N06xfKEwK52KITVIjw9dJg%3D%3D,"Job Title: Java Backend Developer
Location: Phoenix, AZ
Visa: Any
Job Description
Strong experience with Java backend development , experience with large data processing applications using Flink/Beam
Experience with GCP will be a plus.
Experience Big Query or Oracle is needed
Show more
Show less"
Software Developer,Cavalry Portfolio Services,"Phoenix, AZ
1 week ago",https://www.linkedin.com/jobs/view/software-developer-at-cavalry-portfolio-services-4145966458?position=15&pageNum=0&refId=U%2FMlleeZRyObDBg%2FLIpiUg%3D%3D&trackingId=nh6oKW5cqWTYGe4ugjqUZg%3D%3D,"Software Developer – C#, Angular, TypeScript, SQL (Oracle/MSSQL)
Location:
Phoenix, AZ (Onsite/Hybrid)
Cavalry Portfolio Services, LLC is seeking a skilled
Software Developer
with experience in
C#, Angular, TypeScript, and SQL (Oracle or MSSQL)
to join our team in
Phoenix, AZ
. This is a hybrid position requiring
three in-office days per week
, so candidates must be within a
reasonable commuting distance
.
Non-local candidates and those requiring sponsorship will not be considered.
Apply by sending your resume directly to
slapa@cavps.com.
Compensation is based on experience and qualifications within the range of $85,000 to $125,000 annually.
About the Role
As a Software Developer at Cavalry, you will
design, build, and optimize applications that integrate with complex databases, ensuring efficiency and scalability
. This role provides opportunities to expand your skills in
modern web and backend development
while working in a collaborative, fast-paced environment.
Key Responsibilities
Develop and maintain
Windows and web applications
to improve operational efficiency and support evolving business needs.
Work with
relational databases (Oracle or MSSQL)
, ensuring data integrity and application performance.
Conduct testing to ensure applications meet functional and business requirements.
Collaborate with cross-functional teams to design and implement new features.
Create technical documentation and contribute to end-user training as needed.
Ensure compliance with regulatory and company policies.
Required Skills & Qualifications
Professional software development experience
with a focus on backend and frontend technologies.
Strong proficiency in
.NET development
(
C#
).
Experience with
Angular and TypeScript
for modern web application development.
Knowledge of
relational databases
and SQL (
Oracle PL/SQL or Microsoft T-SQL
).
Preferred Experience (Nice to Have)
Hands-on experience with
Oracle PL/SQL
and/or
Microsoft SQL Server
.
Familiarity with
cloud-based architectures and AWS services
.
Experience with
Machine Learning (ML) and Artificial Intelligence (AI) applications
.
Knowledge of
microservices architecture
.
About Cavalry
Founded in 2002, Cavalry Portfolio Services is a leader in acquiring and managing non-performing consumer loan portfolios. Our mission is to
help customers find affordable solutions to resolve their debts
while maintaining the highest professional standards.
We offer a
competitive benefits package
, including:
✔ Hybrid work schedule (
three in-office days per week
)
✔
401K with employer match
✔ Health, dental, and vision insurance
✔ A collaborative and supportive team environment
If you are a
motivated developer
looking to work with
C#, Angular, TypeScript, and SQL in a dynamic financial services environment
, we’d love to hear from you!
📩
Apply by sending your resume to:
slapa@cavps.com
Show more
Show less"
Java Developer,Tata Consultancy Services,"Phoenix, AZ
Actively Hiring
5 days ago",https://www.linkedin.com/jobs/view/java-developer-at-tata-consultancy-services-4130169153?position=16&pageNum=0&refId=U%2FMlleeZRyObDBg%2FLIpiUg%3D%3D&trackingId=qR23Z2mhmcADjngDh5KB5w%3D%3D,"Develop, test, Deploy and maintain application software in java.
Deep understanding of Java, REST webservices, Spring Boot, Spring Batch and Microservices. Extensive development of new functionalities using above mentioned technologies.
Automate the scheduler and develop jobs to load data in to database and monitor end-to-end system.
Building complex queries in different databases like DB2, Postgres and Cassandra.
Build and test the Rest API'S and develop the unit test cases and suits on Junit.
Production support for the applications with the extensive debugging to identify the root cause and fixing customer incidents
Salary Range- $110,000-$125,000 a year
Show more
Show less"
Software Developer - Websites,Sandhills Global,"Scottsdale, AZ
Actively Hiring
5 days ago",https://www.linkedin.com/jobs/view/software-developer-websites-at-sandhills-global-3594991424?position=17&pageNum=0&refId=U%2FMlleeZRyObDBg%2FLIpiUg%3D%3D&trackingId=PvarFdxr3oVu0WAlByrMuQ%3D%3D,"As part of our website development team you will be involved in the development and enhancement of our public facing websites and/or surrounding systems. Our websites are some of the leading digital marketplaces for users looking to buy or sell different types of equipment or items in the markets we serve. In this team you will have an opportunity to make a big impact on how millions of users interact with our sites and find what they are looking to buy.
Our team works in an agile environment and takes an iterative approach to developing solutions. We also run in a modified scrum framework that fits our SDLC. We utilize in-house developed, easy to use tools for managing the backlog, planning, and day to day work. Our teams are highly collaborative and take a team oriented approach to development.
Participate in solution design to satisfy a wide range of business needs.
Analysis and translation of business requirements into technical requirements for development, and creation of design documents and technical specifications.
Adhere to best practices and standards in the areas of development, technology, and security.
Provide post-implementation support, including, but not limited to, monitoring application performance and debugging existing code.
Keep up with advancements and changes in technology and develop an understanding of how new technologies can be leveraged to provide business solutions.
Many projects employ client-side technologies, including JavaScript, jQuery, React.js, CSS, and HTML5 to develop robust and highly interactive web-based UIs.
Projects may include development of new products and new features or maintenance of existing software using agile practices as part of a collaborative and open environment.
Assume other duties as assigned.
Skills/Knowledge/Abilities Preferred
Understanding of SEO and principles surrounding it.
Website and API development using the Microsoft stack (C#/VB, ASP.NET, MS-SQL, IIS, Windows Server, .NET Framework, .NET Core).
Strong front end UI skills using client-side technologies such as JS, jQuery, React.js , CSS, and HTML5.
Strong relational database knowledge.
MS-SQL Server Knowledge and experience (Scripting, Indices, Views, Stored Procedures).
Ability to perform effectively in a team-oriented environment.
Ability to quickly learn new technologies. We regularly use and explore new technologies to efficiently solve our technical problems.
Strong analytical skills to determine effective approaches to business solutions.
Understanding of best practices and methods to integrate applications within the organization and with external partners.
Strong knowledge of the full software development life cycle, with exposure to agile or iterative approaches to delivery preferred.
TFS and TFVC
In Office Position. 4.5 day regular work week. Ability to commute daily to local office is required.
Excellent oral and written communication skills
Results oriented
Flexible and open to change
Stable and progressive work history
Professional appearance and demeanor
Show more
Show less"
Software Engineer Entry Level,General Dynamics Mission Systems,"Scottsdale, AZ
Actively Hiring
2 days ago",https://www.linkedin.com/jobs/view/software-engineer-entry-level-at-general-dynamics-mission-systems-4151749066?position=18&pageNum=0&refId=U%2FMlleeZRyObDBg%2FLIpiUg%3D%3D&trackingId=f1wLSI2M9sZ5YYSlqraNfg%3D%3D,"Basic Qualifications
Requires a Bachelor’s degree in Software Engineering, or a related Science, Engineering or Mathematics field. Agile experience preferred.
CLEARANCE REQUIREMENTS:
[Department of Defense Secret security clearance is preferred at time of hire.] Applicants selected will be subject to a U.S. Government security investigation and must meet eligibility requirements for access to classified information. Due to the nature of work performed within our facilities, U.S. citizenship is required.
Responsibilities For This Position
ROLE AND POSITION OBJECTIVES:
As a software engineer for SDA, you’ll be a member of a cross functional team responsible for Msking some of the most advance systems even smarter.
What sets you apart:
Clear understanding of the software engineering concepts, principles, theories, software development process, and agile methodology
Clear understanding of the software development process, with agile experience
Ability to grasp and apply new information quickly and handle increasing responsibilities with growing complexity
Team player who thrives in collaborative environments and revels in team success
Commitment to ongoing professional development for yourself and others
Our Commitment to You:
An exciting career path with opportunities for continuous learning and development.
Research oriented work, alongside award winning teams developing practical solutions for our nation’s security
Flexible schedules with every other Friday off work, if desired (9/80 schedule)
Competitive benefits, including 401k matching, flex time off, paid parental leave, healthcare benefits, health & wellness programs, employee resource and social groups, and more
See more at gdmissionsystems.com/careers/why-work-for-us/benefits
Workplace Options:
This position is fully onsite with the chance to have some flex.
While on-site, you will be a part of the SDA team in Scottsddale AZ
Target salary range: USD $74,050.40/Yr. - USD $82,149.60/Yr. This estimate represents the typical salary range for this position based on experience and other factors (geographic location, etc.). Actual pay may vary. This job posting will remain open until the position is filled.
Company Overview
At General Dynamics Mission Systems, we rise to the challenge each day to ensure the safety of those that lead, serve, and protect the world we live in. We do this by making the world’s most advanced defense platforms even smarter. Our engineers redefine what’s possible and our manufacturing team brings it to life, building the brains behind the brawn on submarines, ships, combat vehicles, aircraft, satellites, and other advanced systems.
We pride ourselves in being a great place to work with this shared sense of purpose, committed to a diverse and exciting employee experience that drives innovation and creates a community where all feel welcome and a part of something amazing.
We offer highly competitive benefits and a flexible work environment where contributions are recognized and rewarded. To see more about our benefits, visit https://gdmissionsystems.com/careers/why-work-for-us/benefits
General Dynamics is an Equal Opportunity/Affirmative Action Employer that is committed to hiring a diverse and talented workforce. EOE/Disability/Veteran
Show more
Show less"
