Job Title,Company,Address,Link,Description
Software Engineer - Early Career,ASM,"Greater Phoenix Area
Actively Hiring
2 days ago",https://www.linkedin.com/jobs/view/software-engineer-early-career-at-asm-4120236539?position=1&pageNum=0&refId=U%2FMlleeZRyObDBg%2FLIpiUg%3D%3D&trackingId=D3ta6MIUo6IPPkU2u21T2A%3D%3D,"Step into a career with ASM, where cutting edge technology meets collaborative culture.
For over 55 years ASM has been ahead of what’s next, at the forefront of innovation and what’s technologically possible. With more than 4,500 ASMers representing 70 nationalities, our people and our advanced semiconductor devices are playing a crucial role in trends such as 5G, cloud computing, AI, and autonomous driving.  But we’re more than just a tech company. We value diversity, inclusion and sustainability as we strive to make a positive impact on the world. Our development programs help support your growth, shaping your future and pushing the boundaries of innovation to unleash potential.
Role Overview
At ASM, the Software Engineering team works on delivering software that has immediate, tangible results visible in the operation of semiconductor processing equipment hardware. The hardware includes robotics, gas valves, temperature controllers and other hardware. Come join our team and have the opportunity to:
Develop Advance software for cutting edge tech
See your work have real results by driving the most advanced HW in the SEMI industry
Work with a global team full of talented Software Engineers
Solve complex problems using AI/ML/Advanced Algorithms/Data Science
Be part to the team that leads the next generation of SEMI manufacture control Software technology and trends
Travel globally and visit major chip makers FAB sites
Work in Phoenix, the heart of the next SEMI tech hub
Responsibilities
Design, develop, test, deploy, maintain and improve software for our semiconductor manufacturing equipment
Developing for Windows and Windows Real-time Operating Systems
Troubleshoot and resolve computer software issues, including real-time software control systems
Able to triage mechanical, electrical and software bugs
Responsible to manage escalation calls with field support engineers and customers at a national and global level
Work with QA / Support team to add replicated bugs to regression
Author, revise, and review system specifications, software designs, test plans, and other software documentation.
Investigate both internal and external inquiries, questions and problem reports. Offer problem analysis, solutions, or alternatives as a result of these investigations.
Evaluate software engineering tools.
Participate in system design teams.
Travel to customer sites to support installations, training, and troubleshooting of ASM products.
Develop schedules for software development efforts.
Provide engineering solutions to resolve all software issues
Evaluating new software and hardware tools for possible department use
Minimum Qualifications
We are looking for candidates who have graduated within the last 0-2 years or will graduate in Spring or Fall 2025 and are eager to begin or advance their career.
Strong software development skills in C++ or C#
1+ years’ experience as a generalist or mid-stack software development with a Bachelor's degree OR recently graduated with Masters degree in Computer Science, Computer Engineering or Computer Systems
Preferred Qualifications
Strong software development skills in C++ or C#
Educational background in Computer Science or Computer Systems
Experience working with multiple items listed below
Software for Machine Control (including Semiconductor equipment)
Developing for Windows and Windows Real-time Operating Systems
Multi-threaded applications
Real-time software
Graphical User Interfaces
Device drivers or other interrupt driven software preferred
Data Communications and Networking
Knowledge of programming tools such as text editors, debuggers, application builders and configuration management tools.
Ability to read code and understand the functionality implemented and the ability to translate the functionality into another piece of software
Comprehend software documentation including specification and design documents, communication interface specific and API description
Apply Today To Be Part Of What’s Next.
We make the tech that enables the chips in devices which improve lives around the world. We do this with an eye to the future, pushing the boundaries of what’s possible through cutting-edge innovation, and driving the next wave of technological breakthroughs that shape how we live, work, and connect.
To learn more about ASM, find us at asm.com and on LinkedIn, Facebook, Instagram, X and YouTube.
ASM is an equal opportunity employer and considers qualified applicants for employment without regard to race, color, religion, age, nationality, social or ethnic origin, sexual orientation, gender, gender identify or expression, marital status, pregnancy, political affiliation, disability, genetic information, veteran status, or any other characteristic protected by law.
Show more
Show less"
Software Engineer 1,Choice Hotels International,"Scottsdale, AZ
6 days ago",https://www.linkedin.com/jobs/view/software-engineer-1-at-choice-hotels-international-4153442573?position=2&pageNum=0&refId=U%2FMlleeZRyObDBg%2FLIpiUg%3D%3D&trackingId=4XvDmraeZe%2BG3hsLy5a1Lw%3D%3D,"Who are we looking for?
Choice Hotels, one of the world’s largest lodging franchisors, has an exciting opportunity for a
Software Engineer 1
in the
Enterprise Architecture team
. Our Enterprise Architecture team plays a critical role in bridging business and technology, focusing on both traditional enterprise architecture and forward-thinking innovation. We drive technology adoption by solving organizational challenges and creating proof-of-concept solutions that streamline business processes.
As a Software Engineer 1, you will collaborate with principal architects and developers to develop, test, and deploy innovative solutions that address pain points across the organization. This role provides an opportunity to work with the latest technologies, including Apple Silicon developer machines, GitHub Copilot, and AI models, use languages such as Python, Java, and TypeScript (Next.js), and deploy applications to AWS using Harness. If you thrive in an environment that values problem-solving, adaptability, innovation, and curiosity, we invite you to apply today and
#MakeItYourChoice
.
Your Responsibilities
Develop and test proof-of-concept (PoC) solutions to tackle business and technical challenges.
Work closely with senior architects to turn innovative ideas into executable solutions.
Write secure, maintainable, and high-quality code using Python, Java, or TypeScript (Next.js).
Deploy applications to AWS using Harness and implement cloud best practices.
Participate in peer code reviews and ensure adherence to coding standards.
Collaborate with cross-functional teams to identify and resolve technology bottlenecks.
Assist in defining system architecture and best practices for application development.
Research and experiment with emerging technologies to drive innovation.
Develop and execute unit tests using PyTest, JUnit, or Jest.
Contribute to technical documentation and maintain system knowledge base.
Your Experience, Skills & Competencies
Bachelor’s degree in computer science, engineering, or a related field (or equivalent experience).
1-2 years of experience in software development with exposure to full-stack development.
Proficiency in at least one of Python, Java, or TypeScript (Next.js).
Experience with AWS services (Lambda, S3, API Gateway, DynamoDB, etc.).
Familiarity with DevOps tools like Harness, Jenkins, or GitHub Actions.
Understanding of agile methodologies and experience working in scrum teams.
Strong problem-solving skills and ability to work independently.
Ability to quickly learn and adapt to new technologies.
Strong communication skills with the ability to articulate technical solutions.
Your Team
This is an individual contributor role reporting to the Senior Director, Enterprise Architecture. You will be part of a growing team of three engineers, with guidance and mentorship from three principal architects. You will collaborate regularly with cross-functional teams to bring innovative solutions to life.
Your Work Location
As our Software Engineer 1, you will be based in our Scottsdale, AZ technology hub. This world-class facility, opened in October 2021, fosters collaboration and innovation among top-tier technology professionals.
About Choice
Choice Hotels International, Inc. (NYSE: CHH) is one of the largest lodging franchisors in the world. With nearly 7,500 hotels, representing nearly 630,000 rooms, in 46 countries and territories, with a range of high-quality lodging options from limited service to full-service hotels in the upper upscale, upper mid-scale, midscale, extended-stay, and economy segments. We’re the hotel company for those who choose to bet on themselves – the underdog, the dreamer, the entrepreneur – because that’s who we are, too.
At Choice, we are united by the simple belief that tomorrow will be even better than today – for associates, our company, and our franchisees. At our worldwide corporate headquarters in North Bethesda, MD, our technology center in Scottsdale, AZ, and through our associates around the globe, every voice is heard, and every idea is listened to, no matter what area of the company they come from. We are united in supporting the entrepreneurial dreams of our more than 18,000 franchise owners, which propels us forward – giving our work at Choice a purpose larger than our business.
PLEASE NOTE: This role is not eligible for sponsorship ***
Ability to model Choice’s Cultural Values: Welcome and Respect Everyone, Be Bold, Be Quick, Listen, Be Curious and Show Integrity.
Show more
Show less"
Python Engineer,Carvana,"Tempe, AZ
Actively Hiring
2 weeks ago",https://www.linkedin.com/jobs/view/python-engineer-at-carvana-4141191613?position=3&pageNum=0&refId=U%2FMlleeZRyObDBg%2FLIpiUg%3D%3D&trackingId=rsKlkvs6mf02zS7t5aTMJA%3D%3D,"About Carvana
“We believe CVNA is in the early stages of becoming the next U.S. retail category killer.”
– Stephens Investment Bank, Analyst Report, Sept. 2024
Building leading-edge technology has been at the core of Carvana’s strategy since our founding, driving us to become the 3rd fastest company in history to organically reach the Fortune 500 following only Amazon and Google. Today, we remain founder-lead and as ambitious as ever. In 2024, we have not only emerged as the fastest growing automotive retailer, but also the most profitable thanks to our deep vertical integration across retail, lending, vehicle transportation, wholesale auctions, and more.
If You Want To Grow Not Just As An Engineer But As a Leader And Business-builder, Carvana Is The Place For You. Our Technology Teams Build
End-to-end ecommerce for both selling and buying cars, including everything you see on Carvana.com and in our mobile apps.
AI-driven customer support across chat, email, SMS, and voice, as well as a proprietary CRM platform to ensure the most efficient and highest quality customer experience.
360° vehicle photography and interactive merchandising using cutting edge computer vision and AI techniques.
The most sophisticated and self-service automotive lending platform in the world.
Systems and tools behind a nationwide logistics network that has delivered and picked up over 3 million cars via our fully owned and operated fleet of automotive haulers, efficiently managing distribution of our massive inventory to 85% of US driveways.
Enterprise grade systems for operating the largest vehicle reconditioning facilities in the US, with workflow and automation to guide the work for everything mechanical, electrical, and cosmetic needed to bring each car to our high standards.
Early adoption and customization of AI tools for optimizing our Developer efficiency and experience.
And much, much more…
THIS IS A 100% ON-SITE POSITION FROM OUR HQ IN TEMPE (Monday through Friday)
Job Description...
As a Software Engineer on our Next Generation Communications Platform (NGCP) team, you’ll design and build microservices that integrate cutting-edge LLMs and AI models, and support ML pipelines for continuous improvement of our AI capabilities. The NGCP team is a passionate and collaborative group of experts in Product, Design, Data Science, and Engineering who are redefining customer experience at Carvana. At the heart of our work is a cutting-edge communication platform that empowers car buyers and sellers to enjoy an effortless car shopping experience every day. We build our systems from the ground up with a relentless focus on the end-consumer, and we’re looking for someone who shares our vision to join our team.
As a key member of the NGCP team, you’ll play an integral role in shaping Sebastian, our interactive chat-bot system, where you’ll work with cutting edge generative AI models in order to provide best-in-class customer service for all our customers. You’ll also contribute to our overarching data and AI strategy, enhancing a suite of ML-driven services that support our customers and advocates. Collaborating closely with our Product, Data Science, and Software Engineering teams, you’ll help transform every stage of the purchase process—from search right through to vehicle delivery.
Responsibilities
Enhance our NGCP platform by developing APIs and infrastructure that connect Sebastian, our AI chat bot, to communication channels like SMS, chat, voice, email, messaging services and the web
Creating systems, APIs, and tooling for enabling end-to-end dialogs between our AI and customers to improve the communication experience
Leverage the latest foundational models from OpenAI, Google, Anthropic and LLM frameworks to improve customers’ experiences.
Work with the Data Science team to build out services for training, monitoring and enhancing machine learning models’ accuracy
Help drive forward our MLOps framework to streamline model development, deployment and monitoring.
Full software development lifecycle from design and development to testing and operating in production
Communicate effectively with engineers, product managers and data scientists
Required Skills And Experience
Experience with Python, SQL
Experience with cloud APIs (e.g., GCP, AWS, Azure)
Experience using generative AI models like GPT-4/GPT-4o, Claude, others
Strong foundation in algorithms and data structures and their real-world use cases
Understanding of computer systems and networks
Production quality coding standards and patterns
Bonus Skill (helpful But Not Required)
Kubernetes and Docker
Experience with Copilot, Cline or other developer AI assistants
Experience with ML frameworks like TensorFlow or PyTorch
MLOps tools (Mlflow, Kubeflow)
What We’ll Offer In Return
Full-Time Salary Position with a competitive salary.
Medical, Dental, and Vision benefits.
401K with company match.
A multitude of perks including student loan payments, discounts on vehicles, benefits for your pets, and much more.
A great wellness program to keep you healthy and happy both physically and mentally.
Access to opportunities to expand your skill set and share your knowledge with others across the organization.
A company culture of promotions from within, with a start-up atmosphere allowing for varied and rapid career development.
Legal Stuff...
Hiring is contingent on passing a complete background check. This role is not eligible for visa sponsorship.
Carvana is an equal employment opportunity employer. All applicants receive consideration for employment without regard to race, color, religion, gender, sexual orientation, gender identity or expression, marital status, national origin, age, mental or physical disability, protected veteran status, or genetic information, or any other basis protected by applicable law. Carvana also prohibits harassment of applicants or employees based on any of these protected categories.
Please note this job description is not designed to contain a comprehensive listing of activities, duties, or responsibilities that are required of the employee for this job. Duties, responsibilities, and activities may change at any time with or without notice.
Show more
Show less"
Entry Level Software Developer,SkillStorm,"Chandler, AZ
Actively Hiring +4 benefits
1 week ago",https://www.linkedin.com/jobs/view/entry-level-software-developer-at-skillstorm-4131437908?position=4&pageNum=0&refId=U%2FMlleeZRyObDBg%2FLIpiUg%3D%3D&trackingId=JuWnYAAerZhtgWSRxCtJvg%3D%3D,"SkillStorm is actively seeking full-time Entry Level Software Developers for our government agency clients in Lake Mary, FL or Gilbert, AZ. An ideal candidate is one with a strong technical mindset, exceptional problem-solving skills, and logical reasoning abilities.
This position requires the ability to obtain a security clearance and relocate to Lake Mary, FL or Gilbert, AZ.
You will spend 12 weeks collaborating in team-based settings, undertaking diverse, real-world projects to prepare for seamless integration into our clients' operations. Once training is complete, you will be deployed to our enterprise or government clients, ready to have an immediate impact on day one.
Entry Level Software Developer Requirements
Must possess a Bachelor's degree
1-3 Years of previous of paid W2 experience required (does not have to be IT or tech related)
AND
1 year of paid W2
TECHNCIAL
experience
Must be open to relocation to Lake Mary, FL or Gilbert, AZ
Possess a strong understanding of programming principles, data structures, algorithms, databases, and SQL, enabling the development of software solutions.
Experience with software development and programming using Java, C#, or similar object-oriented programming language.
Ability to obtain a security clearance. (The process involves a thorough background check, including a review of criminal records, tax records, employment history, drug possession, and personal references.)
Legally authorized to work in the U.S. under SkillStorm's W2; not a C2C position. EOE, including disability/vets.
Strong analytical and problem-solving skills along with a logical mindset to tackle complex challenges to develop effective and innovative solutions.
Demonstrate excellent verbal and written communication skills, facilitating clear and effective interactions with team members, stakeholders, and clients.
Entry Level Software Developer Responsibilities
Develop new applications and modify existing applications using programming languages, platforms, frameworks, and tools used by our clients.
Pay keen attention to detail to ensure solutions meet business requirements and are operationally supportable and collaborate with teams to create visual mock-ups, prototypes, and diagrams.
Develop well-structured, readable, and efficient code to solve specific tasks or improve existing applications. Adhere to coding standards and best practices to maintain high-quality software.
Identify, diagnose, and fix bugs in software applications, ensuring that the applications run smoothly and efficiently. Provide technical support and problem resolution related to software issues.
Engage in code review sessions with peers to ensure code quality, share knowledge, and learn from others. Provide constructive feedback and suggest improvements to optimize performance.
Create and maintain technical documentation for software applications, which may include user guides, system manuals, and FAQs, to support end-users and future development efforts.
Keep up-to-date with the latest industry trends, programming techniques, and technologies. Participate in workshops, seminars, and training sessions to enhance technical skills and knowledge.
Work with stakeholders to understand and analyze requirements for new projects or enhancements to existing applications. Translate business needs into technical specifications.
Assist in the deployment and testing of applications to production environments, ensuring that they meet performance benchmarks and are compatible with other system components.
Work closely with other departments, such as quality assurance, project management, and product management, to ensure that projects are delivered on time and meet predefined objectives. Communicate ongoing activities and results to business sponsors, stakeholders, and management.
Where SkillStorm stands out:
Salary range- $52k-$74k annually
Enterprise level technology training and certification
Opportunity to work for enterprise companies and government agencies
Health, Vision, Dental, and Life Insurance with 401K
Continuous mentorship and support
About SkillStorm
Founded in 2002, SkillStorm was built on the mission of accelerating careers in high-demand technologies. We build customer-ready technology workforces for top Fortune 100 companies, government agencies, and system integrators within the U.S. Through collaboration with our software partners and customers, we create and advance purpose-built technology experts with the custom tech stacks, clearances, certifications, and location requirements of our clients. As a result of a robust supply chain of experienced tech professionals, our clients realize their business initiatives faster, and significantly increase productivity with Day-One effective technology teams at scale.
All qualified applicants will receive consideration for employment without regard to race, color, religion, sex, sexual orientation, gender identity, national origin, disability, or status as a protected veteran.
Show more
Show less"
Web Developer,Talent Groups,"Scottsdale, AZ
Actively Hiring
2 weeks ago",https://www.linkedin.com/jobs/view/web-developer-at-talent-groups-4118879822?position=5&pageNum=0&refId=U%2FMlleeZRyObDBg%2FLIpiUg%3D%3D&trackingId=M%2FmoJA%2FGNpoWuFqHQUGIJA%3D%3D,"We have partnered with our client in the search for a Web Developer skilled in React, TypeScript/JavaScript, and Node.js to build and maintain scalable web applications and microservices. This role involves leveraging Kubernetes and Argo CD in an Agile environment to deliver high-quality solutions through collaboration with cross-functional teams.
Responsibilities
Develop and Maintain web applications using React and TypeScript /JavaScript
Develop scalable Microservices utilizing Node.js
Utilize Kubernetes for container orchestration and Argo CD for continuous deployments
Collaborate with cross functional teams in an Agile/Scrum environment to deliver high-quality software solutions
Skills and Experience:
2+ years of experience in software development with a focus on TypeScript/JavaScript and frameworks such as React
Hands-on experience in building microservices with Node.js
Proficiency in Git for version control
Understanding of CI/CD principles and pipeline configurations
Familiarity with regular expressions for pattern matching in text
Basic knowledge of software development methodologies
Strong communication skills, both written and verbal, with the ability to explain technical concepts clearly and patiently
A proactive approach to learning new skills and applying knowledge to solve complex problems
Show more
Show less"
