Job Title,Company,Address,Link,Description
Software Engineer,Epic,"Phoenix, AZ
Actively Hiring
5 days ago",https://www.linkedin.com/jobs/view/software-engineer-at-epic-3986111801?position=32&pageNum=0&refId=U%2FMlleeZRyObDBg%2FLIpiUg%3D%3D&trackingId=agk8mCSQVs%2F3pLZxlwrADA%3D%3D,"Please note that this position is based on our campus in Madison, WI, and requires relocation to the area. We recruit nationally and provide financial relocation assistance.
Code that saves lives.
As a software developer at Epic, you’ll write software that impacts the lives of 75% of Americans and 300 million patients around the world. Working in your own office, surrounded by thousands of high-caliber developers, you’ll use modern development methodologies and employ user-centered design, analytics, and machine learning tools to drive innovation in healthcare. Using leading-edge technologies and languages like JS, TS, and C#, you’ll invent better ways to reduce medical errors, streamline record sharing between hospitals, and provide the quality of care a patient deserves. Learn more about our team at https://careers.epic.com/jobs/softwaredevelopment/.
Write software for the most innovative health systems on the planet.
The top-ranked health systems in U.S. News and World Report are Epic customers. Our community includes major systems like the Mayo Clinic, Johns Hopkins, Cleveland Clinic, and Kaiser Permanente, as well as leading academic medical centers at the University of Wisconsin, University of Michigan, University of California, University of Texas, The Ohio State University, and many more.
Live affordably in a city known for its rising tech talent.
Epic is located just outside Madison, Wisconsin, the second fastest growing market for tech talent in the United States and home to the state capital and the University of Wisconsin. Madison, a city surrounded by water, has received accolades for being the greenest city in America (NerdWallet), the best city for renters (SmartAsset), the fittest city in America (Fitbit), and the third best metro in the US for young professionals (Forbes Advisor).
More than just important work
.
Our uniquely themed campus was designed to heighten your ability to get stuff done in your office, a conference room, or by the fireplace in a comfy chair. All meals are restaurant-quality but cost only a few dollars, and they’re prepared by a team comprised of kitchen talent from restaurants around the country. And, after five years here, you’ll earn a four-week sabbatical anywhere in the world. Staff have kayaked in Patagonia, attended a Beyoncé concert in Ireland, built a library in Tanzania, and run a marathon in Antarctica.
We offer comprehensive benefits to keep you healthy and happy as you grow in your life and career, and your merit-based compensation will reflect the impact your work has on the company and our customers. You'll also be eligible for annual raises and bonuses, as well as stock grants, which give you an even greater stake in the success of Epic and our customers. Healthcare is global, and building the best ideas from around the world into Epic software is a point of pride. As an Equal Opportunity Employer, we know that inclusive teams design software that supports the delivery of quality care for all patients, so diversity, equity, and inclusion are written into our principles. Please see our full non-discrimination statement at https://careers.epic.com/EEO.
Relocation to the Madison, WI area (Reimbursed)
BS/BA or greater in Computer Science, Mathematics, Software Engineering, Computer Engineering, or a related field
A history of academic excellence or professional success
Eligible to work in the United States without visa sponsorship (persons with appropriate qualifications and eligible for TN status under NAFTA may apply)
COVID-19 vaccination
Show more
Show less"
Software Engineer,SkillStorm,"Phoenix, AZ
Actively Hiring
1 week ago",https://www.linkedin.com/jobs/view/software-engineer-at-skillstorm-4112995353?position=33&pageNum=0&refId=U%2FMlleeZRyObDBg%2FLIpiUg%3D%3D&trackingId=61ksIsaSLTDMWSoPpraNcg%3D%3D,"SkillStorm is actively seeking full-time Entry Level Software Developers for our government agency clients in Lake Mary, FL or Gilbert, AZ. An ideal candidate is one with a strong technical mindset, exceptional problem-solving skills, and logical reasoning abilities.
This position requires the ability to obtain a security clearance and relocate to Lake Mary, FL or Gilbert, AZ.
You will spend 12 weeks collaborating in team-based settings, undertaking diverse, real-world projects to prepare for seamless integration into our clients' operations. Once training is complete, you will be deployed to our enterprise or government clients, ready to have an immediate impact on day one.
Entry Level Software Developer Requirements
Must possess a Bachelor's degree
1-3 Years of previous of paid W2 experience required (does not have to be IT or tech related)
AND
1 year of paid W2
TECHNCIAL
experience
Must be open to relocation to Lake Mary, FL or Gilbert, AZ
Possess a strong understanding of programming principles, data structures, algorithms, databases, and SQL, enabling the development of software solutions.
Experience with software development and programming using Java, C#, or similar object-oriented programming language.
Ability to obtain a security clearance. (The process involves a thorough background check, including a review of criminal records, tax records, employment history, drug possession, and personal references.)
Legally authorized to work in the U.S. under SkillStorm's W2; not a C2C position. EOE, including disability/vets.
Strong analytical and problem-solving skills along with a logical mindset to tackle complex challenges to develop effective and innovative solutions.
Demonstrate excellent verbal and written communication skills, facilitating clear and effective interactions with team members, stakeholders, and clients.
Entry Level Software Developer Responsibilities
Develop new applications and modify existing applications using programming languages, platforms, frameworks, and tools used by our clients.
Pay keen attention to detail to ensure solutions meet business requirements and are operationally supportable and collaborate with teams to create visual mock-ups, prototypes, and diagrams.
Develop well-structured, readable, and efficient code to solve specific tasks or improve existing applications. Adhere to coding standards and best practices to maintain high-quality software.
Identify, diagnose, and fix bugs in software applications, ensuring that the applications run smoothly and efficiently. Provide technical support and problem resolution related to software issues.
Engage in code review sessions with peers to ensure code quality, share knowledge, and learn from others. Provide constructive feedback and suggest improvements to optimize performance.
Create and maintain technical documentation for software applications, which may include user guides, system manuals, and FAQs, to support end-users and future development efforts.
Keep up-to-date with the latest industry trends, programming techniques, and technologies. Participate in workshops, seminars, and training sessions to enhance technical skills and knowledge.
Work with stakeholders to understand and analyze requirements for new projects or enhancements to existing applications. Translate business needs into technical specifications.
Assist in the deployment and testing of applications to production environments, ensuring that they meet performance benchmarks and are compatible with other system components.
Work closely with other departments, such as quality assurance, project management, and product management, to ensure that projects are delivered on time and meet predefined objectives. Communicate ongoing activities and results to business sponsors, stakeholders, and management.
Where SkillStorm stands out:
Salary range- $52k-$74k annually
Enterprise level technology training and certification
Opportunity to work for enterprise companies and government agencies
Health, Vision, Dental, and Life Insurance with 401K
Continuous mentorship and support
About SkillStorm
Founded in 2002, SkillStorm was built on the mission of accelerating careers in high-demand technologies. We build customer-ready technology workforces for top Fortune 100 companies, government agencies, and system integrators within the U.S. Through collaboration with our software partners and customers, we create and advance purpose-built technology experts with the custom tech stacks, clearances, certifications, and location requirements of our clients. As a result of a robust supply chain of experienced tech professionals, our clients realize their business initiatives faster, and significantly increase productivity with Day-One effective technology teams at scale.
All qualified applicants will receive consideration for employment without regard to race, color, religion, sex, sexual orientation, gender identity, national origin, disability, or status as a protected veteran.
Show more
Show less"
Software Engineer,Epic,"Chandler, AZ
Actively Hiring
6 days ago",https://www.linkedin.com/jobs/view/software-engineer-at-epic-3986116437?position=34&pageNum=0&refId=U%2FMlleeZRyObDBg%2FLIpiUg%3D%3D&trackingId=Dgqbe3wsqrXrlVcfXs4u8w%3D%3D,"Please note that this position is based on our campus in Madison, WI, and requires relocation to the area. We recruit nationally and provide financial relocation assistance.
Code that saves lives.
As a software developer at Epic, you’ll write software that impacts the lives of 75% of Americans and 300 million patients around the world. Working in your own office, surrounded by thousands of high-caliber developers, you’ll use modern development methodologies and employ user-centered design, analytics, and machine learning tools to drive innovation in healthcare. Using leading-edge technologies and languages like JS, TS, and C#, you’ll invent better ways to reduce medical errors, streamline record sharing between hospitals, and provide the quality of care a patient deserves. Learn more about our team at https://careers.epic.com/jobs/softwaredevelopment/.
Write software for the most innovative health systems on the planet.
The top-ranked health systems in U.S. News and World Report are Epic customers. Our community includes major systems like the Mayo Clinic, Johns Hopkins, Cleveland Clinic, and Kaiser Permanente, as well as leading academic medical centers at the University of Wisconsin, University of Michigan, University of California, University of Texas, The Ohio State University, and many more.
Live affordably in a city known for its rising tech talent.
Epic is located just outside Madison, Wisconsin, the second fastest growing market for tech talent in the United States and home to the state capital and the University of Wisconsin. Madison, a city surrounded by water, has received accolades for being the greenest city in America (NerdWallet), the best city for renters (SmartAsset), the fittest city in America (Fitbit), and the third best metro in the US for young professionals (Forbes Advisor).
More than just important work
.
Our uniquely themed campus was designed to heighten your ability to get stuff done in your office, a conference room, or by the fireplace in a comfy chair. All meals are restaurant-quality but cost only a few dollars, and they’re prepared by a team comprised of kitchen talent from restaurants around the country. And, after five years here, you’ll earn a four-week sabbatical anywhere in the world. Staff have kayaked in Patagonia, attended a Beyoncé concert in Ireland, built a library in Tanzania, and run a marathon in Antarctica.
We offer comprehensive benefits to keep you healthy and happy as you grow in your life and career, and your merit-based compensation will reflect the impact your work has on the company and our customers. You'll also be eligible for annual raises and bonuses, as well as stock grants, which give you an even greater stake in the success of Epic and our customers. Healthcare is global, and building the best ideas from around the world into Epic software is a point of pride. As an Equal Opportunity Employer, we know that inclusive teams design software that supports the delivery of quality care for all patients, so diversity, equity, and inclusion are written into our principles. Please see our full non-discrimination statement at https://careers.epic.com/EEO.
Relocation to the Madison, WI area (Reimbursed)
BS/BA or greater in Computer Science, Mathematics, Software Engineering, Computer Engineering, or a related field
A history of academic excellence or professional success
Eligible to work in the United States without visa sponsorship (persons with appropriate qualifications and eligible for TN status under NAFTA may apply)
COVID-19 vaccination
Show more
Show less"
Software Engineer,Epic,"Mesa, AZ
Actively Hiring
5 days ago",https://www.linkedin.com/jobs/view/software-engineer-at-epic-3986117171?position=35&pageNum=0&refId=U%2FMlleeZRyObDBg%2FLIpiUg%3D%3D&trackingId=zMnzd0ws%2FCk0jB0ETkjwDA%3D%3D,"Please note that this position is based on our campus in Madison, WI, and requires relocation to the area. We recruit nationally and provide financial relocation assistance.
Code that saves lives.
As a software developer at Epic, you’ll write software that impacts the lives of 75% of Americans and 300 million patients around the world. Working in your own office, surrounded by thousands of high-caliber developers, you’ll use modern development methodologies and employ user-centered design, analytics, and machine learning tools to drive innovation in healthcare. Using leading-edge technologies and languages like JS, TS, and C#, you’ll invent better ways to reduce medical errors, streamline record sharing between hospitals, and provide the quality of care a patient deserves. Learn more about our team at https://careers.epic.com/jobs/softwaredevelopment/.
Write software for the most innovative health systems on the planet.
The top-ranked health systems in U.S. News and World Report are Epic customers. Our community includes major systems like the Mayo Clinic, Johns Hopkins, Cleveland Clinic, and Kaiser Permanente, as well as leading academic medical centers at the University of Wisconsin, University of Michigan, University of California, University of Texas, The Ohio State University, and many more.
Live affordably in a city known for its rising tech talent.
Epic is located just outside Madison, Wisconsin, the second fastest growing market for tech talent in the United States and home to the state capital and the University of Wisconsin. Madison, a city surrounded by water, has received accolades for being the greenest city in America (NerdWallet), the best city for renters (SmartAsset), the fittest city in America (Fitbit), and the third best metro in the US for young professionals (Forbes Advisor).
More than just important work
.
Our uniquely themed campus was designed to heighten your ability to get stuff done in your office, a conference room, or by the fireplace in a comfy chair. All meals are restaurant-quality but cost only a few dollars, and they’re prepared by a team comprised of kitchen talent from restaurants around the country. And, after five years here, you’ll earn a four-week sabbatical anywhere in the world. Staff have kayaked in Patagonia, attended a Beyoncé concert in Ireland, built a library in Tanzania, and run a marathon in Antarctica.
We offer comprehensive benefits to keep you healthy and happy as you grow in your life and career, and your merit-based compensation will reflect the impact your work has on the company and our customers. You'll also be eligible for annual raises and bonuses, as well as stock grants, which give you an even greater stake in the success of Epic and our customers. Healthcare is global, and building the best ideas from around the world into Epic software is a point of pride. As an Equal Opportunity Employer, we know that inclusive teams design software that supports the delivery of quality care for all patients, so diversity, equity, and inclusion are written into our principles. Please see our full non-discrimination statement at https://careers.epic.com/EEO.
Relocation to the Madison, WI area (Reimbursed)
BS/BA or greater in Computer Science, Mathematics, Software Engineering, Computer Engineering, or a related field
A history of academic excellence or professional success
Eligible to work in the United States without visa sponsorship (persons with appropriate qualifications and eligible for TN status under NAFTA may apply)
COVID-19 vaccination
Show more
Show less"
Software Developer | Hybrid,OnTrac,"Phoenix, AZ
Actively Hiring
6 days ago",https://www.linkedin.com/jobs/view/software-developer-hybrid-at-ontrac-4149776212?position=36&pageNum=0&refId=U%2FMlleeZRyObDBg%2FLIpiUg%3D%3D&trackingId=XAxbdtbTrW3PgD6TIYI0fQ%3D%3D,"OnTrac
is hiring a
Software Developer
Are you eager to join a dynamic and expanding company where you can both learn and make a meaningful impact? If you possess a strong sense of empathy, enjoy assisting others, thrive in a fast-paced environment, and excel at problem-solving, we encourage you to apply today to connect with a recruiter!
Location: Hybrid
and
MUST
be local to one of the following areas:
Cleveland, OH
Washington, D.C.
Atlanta, GA
Phoenix, AZ
Louisville, KY
Pay:
$90,000 - $100,000 annually
Shift:
Monday to Friday from 8:00am – 5:00pm
Employment Logistics:
The Software Developer position is responsible for the research, design, coding, testing, documentation, and maintenance of internal and external applications.
Unpacking the Benefits:
Competitive individual and group benefits
Medical, Dental, and Vision insurance
Paid Time Off including Holiday pay
401(k) with company match
Safe and clean work environment
The Must-Haves:
College diploma or university degree in the field of computer science or software engineering, and/or 2+ years equivalent work experience.
Your Mission in Motion:
Strategy & Planning
Assist other developers, analysts, and designers in conceptualizing and developing new software programs and applications.
Works with end users to determine requirements.
Plan phases of the software development life cycle (SDLC) for a variety of projects.
Assist in the preparation and documentation of software requirements and specifications.
Research and document requirements of software users.
Acts as a lead on software development projects with other developers
Acquisition & Deployment
Conduct research on emerging application development software products, languages, and standards in support of procurement and development efforts.
Recommend, schedule, and perform software improvements and upgrades.
Operational Management
Consistently write, translate, and code software programs and applications according to project and development specifications.
Monitor software performance of new and existing programs for the purposes of correcting errors, isolating areas for improvement, and general debugging.
Administer critical analysis of test results and deliver solutions to problem areas.
Assist in the development and maintenance of user manuals and guidelines.
Work with network administrators, systems analysts, and software engineers to assist in resolving problems with software products or company software systems.
Perform code reviews and other software QA for other developers
Knowledge & Experience
Working technical knowledge of
Bootstrap, CSS, HTML
Angular
JavaScript
PHP
WordPress
Hands on experience working in integrated development environments
Experience with Microsoft SQL Server and data structures.
Hands-on software troubleshooting experience.
Knowledge of applicable data privacy practices and laws.
Experience with specific phases of the software development life cycle
Personal Attributes
Flexible and adaptable in regards to learning and understanding new technologies.
Strong written and oral communication skills.
Strong interpersonal skills.
Ability to conduct research into software-related issues and products.
Highly self-motivated and directed.
Keen attention to detail.
Openness to direction and constructive criticism for self-improvement
Proven analytical and problem-solving abilities.
Ability to effectively prioritize and execute tasks in a high-pressure environment.
Ability to work both independently and in a team-oriented, collaborative environment.
Founded in 1986,
OnTrac
has evolved into the leading provider of same-day and next-day delivery services in the U.S. for premier e-commerce and product-supply businesses, including five of the largest retailers in the U.S.
If you are excited to be part of our team and grow with our OnTrac family, we invite you to apply!
OnTrac is proud to be an Equal Opportunity Employer
OnTrac is an equal opportunity employer. We value diversity and welcome applications from individuals of all backgrounds, abilities, and experiences. We do not discriminate based on race, color, religion, sex, sexual orientation, gender identity, national origin, disability, or age. Join us in our commitment to creating a diverse and inclusive workplace. If you are excited to be part of our team and contribute to our talent acquisition efforts, we invite you to apply.
Lasership, Inc. dba OnTrac Final Mile with its affiliates, including OnTrac Logistics, Inc. (collectively, ""OnTrac"" or the ""Company"") is an equal opportunity employer
Apply Now
Show more
Show less"
Software Engineer 1 (iOS) - Aviation,Garmin,"Scottsdale, AZ
Actively Hiring
6 days ago",https://www.linkedin.com/jobs/view/software-engineer-1-ios-aviation-at-garmin-4153478516?position=37&pageNum=0&refId=U%2FMlleeZRyObDBg%2FLIpiUg%3D%3D&trackingId=Pc90JIb3gEdNQuyRHLPPSA%3D%3D,"Overview
We are seeking a full-time
Software Engineer 1 (iOS)
in our Chandler, AZ or Scottsdale, AZ location(s). In this role, you will be responsible for building upon existing software solutions to develop basic mobile software for products, applications, or systems new to Garmin. The selected engineer will be working in our Aviation Services department supporting the Commerical Aviation Mobile Application.
Essential Functions
Performs new product and/or application software design and development as well as maintenance activities for products and/or applications already in production using C, C++, C#, Java, assembly language, or other selected languages
Troubleshoots basic issue reports, reproduces issues, evaluates technical cause and implements and tests software solutions
Identifies and resolves defects of basic scope using proper engineering tools and techniques such as debuggers, emulators, simulators, and logic analyzers
Applies design standards and procedures using appropriate engineering tools to document and implement basic designs in an organized manner
Supports working hours as part of a rotating schedule to provide on call support of Garmin’s 24/7 operations
Basic Qualifications
Bachelor’s Degree in Computer Science, Electrical Engineering, Computer Engineering, Software Engineering, Aerospace Engineering, Math, Physics or related field OR an equivalent combination of education and experience
Excellent academics (cumulative GPA greater than or equal to 3.0 as a general rule)
Demonstrated knowledge, education, experience and/or training necessary to develop basic software in C, C++, C#, Java, assembly language, or other selected languages
Desired Qualifications
Outstanding academics (cumulative GPA greater than or equal to 3.5)
Previous work or internship experience in design, particularly for consumer products
Experience in Swift, Objective-C, SwiftUI, UIKit
Aviation experience or pilot license is a plus
Garmin International is an equal opportunity employer. Qualified applicants will receive consideration for employment without regard to race, religion, color, national origin, citizenship, sex, sexual orientation, gender identity, veteran’s status, age or disability.
This position is eligible for Garmin's benefit program. Details can be found here: Garmin Benefits
Show more
Show less"
